{
  "id": "quarkus",
  "kind": "framework",
  "requires": ["java"],
  "capabilities": ["context", "graph", "index", "planning", "prompt", "validation"],
  "detection": {
    "extensions": [],
    "filesAll": [],
    "filesAny": [],
    "contentMarkers": [],
    "alternatives": [
      {
        "filesAll": [],
        "filesAny": [],
        "pathPatternsAll": [],
        "pathPatternsAny": [],
        "contentMarkers": [{"path": "build.gradle", "contains": "io.quarkus"}],
        "contentPatternMarkers": []
      },
      {
        "filesAll": [],
        "filesAny": [],
        "pathPatternsAll": [],
        "pathPatternsAny": [],
        "contentMarkers": [{"path": "build.gradle.kts", "contains": "io.quarkus"}],
        "contentPatternMarkers": []
      },
      {
        "filesAll": [],
        "filesAny": [],
        "pathPatternsAll": [],
        "pathPatternsAny": [],
        "contentMarkers": [{"path": "pom.xml", "contains": "io.quarkus"}],
        "contentPatternMarkers": []
      },
      {
        "filesAll": [],
        "filesAny": ["build.gradle", "build.gradle.kts", "pom.xml"],
        "pathPatternsAll": [],
        "pathPatternsAny": [],
        "contentMarkers": [],
        "contentPatternMarkers": [{"pathPattern": "**/*.java", "contains": "io.quarkus."}]
      }
    ]
  },
  "entrypoints": {
    "java": "org.rostilos.codecrow.plugins.quarkus.QuarkusPlugin",
    "python": "codecrow_plugin_quarkus:create_plugin"
  }
}
