{
  "id": "bash",
  "kind": "language",
  "requires": [],
  "capabilities": [
    "syntax"
  ],
  "detection": {
    "extensions": [
      ".bash",
      ".sh",
      ".zsh"
    ],
    "filesAll": [],
    "filesAny": [],
    "contentMarkers": [],
    "alternatives": []
  },
  "entrypoints": {
    "java": "org.rostilos.codecrow.plugins.bash.BashPlugin"
  }
}
